Nazwa,ECTS,Tryb,Kryteria,kategorie
"Antropologia współczesności: teorie, metody, program badawczy",3.0,mieszany: w sali i zdalniew sali,"Zaliczenie wykładu odbywa się w trakcie egzaminu ustnego. Podczas egzaminu oceniane są: wiedza zawarta w materiale wykładowym i w lekturach obowiązkowych; umiejętność krytycznej analizy poznanych pojęć i teorii, umiejętność ich zastosowania do analizy zjawisk kultury współczesnej.","Socjologia i antropologia, Technologie i dane"
Antropologia prawa i wielość kultur prawnych,3.0,w sali,"Ocena ciągła (obecność)
Praca pisemna na wybrany temat w oparciu o własne badania antropologiczno-kulturowe
Egzamin pisemny
30 godzin kontaktowych
20 godzin przygotowania do egzaminu
20 godzin przygotowania do zajęć: pisanie pracy opartej na badaniach własnych
10 godzin przygotowania do zajęć – czytanie i analiza lektur",Socjologia i antropologia
Dane zastane i wytwarzane: badanie przekazów ikonicznych,2.0,mieszany: w sali i zdalniew sali,"1) Na zajęciach typu warsztatowego obecność jest szczególnie ważna ze względu na ciągłość pracy. Każda nieobecność musi być uzasadniona, a materiał nadrobiony. 
2) Liczy się również aktywność, w tym wywiązywanie się z dostarczania materiału wizualnego do kolejnych zajęć oraz aktywność na zajęciach.
3) Na zaliczenie przedmiotu trzeba przygotować raport badawczy zawierający analizę wybranego materiału ikonicznego co najmniej dwoma metodami.",Inne
Polityka mieszkaniowa,3.0,,Obecność na zajęciach (20%); ocena z egzaminu (80%).,Prawo i polityka
Prawo o organizacjach pozarządowych,3.0,w sali,"Najważniejszą formą weryfikacji i oceniania osiągniętych przez studenta efektów uczenia się jest egzamin pisemny zawierający kilkanaście pytań otwartych. Student powinien wykazać się umiejętnościami przedstawionymi w rubryce „efekty uczenia się”. Oznacza to w szczególności znajomość szczegółowych zagadnień teoretycznych i praktycznych zasad funkcjonowania organizacji pozarządowych w Polsce oraz wybranych krajach europejskich, ich funkcji społecznych, problematyki współpracy z administracją publiczną, zasad wspierania organizacji pozarządowych ze środków publicznych i pozyskiwania funduszy z innych źródeł (fundraising), zasad funkcjonowania i skali zjawiska wolontariatu w Polsce, mechanizmu alokacji 1% oraz problematyki prowadzenia konsultacji społecznych.",Prawo i polityka
Rodzina w dyskursie społecznym,2.0,w sali,"1.	Ocena ciągła – uwzględniająca:
* obecność na zajęciach
* przygotowanie do zajęć
* aktywność na zajęciach 
2.  prezentacja - przygotowana indywidualnie/grupowo
3.  praca zaliczeniowa – forma  do uzgodnienia",Inne
The Other / Otherness in Social Sciences,3.0,,Participation and activity at the seminar plus presentation of seminar text.,Inne
Warsztaty pisarskie,2.0,mieszany: w sali i zdalnie,"• Punktualność nadsyłania zadań pisarskich + jakość tekstów (z uwzględnieniem indywidualnych postępów), 
• obecność i udział w zajęciach (łącznie z lekturą tekstów pisanych przez pozostałych uczestników zajęć),
• wybranie i poprawienie jednego z zadań na koniec warsztatów.",Inne
Zarządzanie projektami,2.0,w sali,"Forma zaliczenia: Warunkiem zaliczenia jest wypełnienie zobowiązań związanych z aktywnym udziałem w zajęciach, a obejmujących obecności na cotygodniowych spotkaniach oraz przygotowanie i prezentacja założeń własnego projektu (praca grupowa w zespołach)",Ekonomia i zarządzanie
Zarządzanie różnymi grupami pracowników,2.0,w sali,"ocena ciągła związana z obecnością na zajęciach (dozwolone są max. 2 nieobecności) i przygotowaniem do zajęć. Kolokwium na ocenę. Konieczność przygotowane scenariusza szkolenia przeznaczonego dla organizacji (praca zespołowa).
50% oceny końcowej= wynik kolokwium
50% oceny końcowej = ocena z prezentacji zespołowej",Ekonomia i zarządzanie
Socjologia przestępczości: spory wokół polityki karania,3.0,w sali,"Egzamin (test)
Liczba nieobecności podlegających usprawiedliwieniu: 4
Zasady zaliczenia poprawkowego: egzamin ustny
Do godzin przeznaczonych na zajęcia w sali (30h) należy doliczyć czas konieczny do przygotowania się do zajęć (czytanie lektur) – 2h tygodniowo oraz czas konieczny do przygotowania się do finalnego zaliczenia (egzaminu) – 15h",Socjologia i antropologia
Siły zbrojne i wojna,3.0,w sali,"Zajęcia kończyć się będą egzaminem pisemnym z czterema pytaniami otwartymi, z których egzaminowani będą odpowiadać na trzy. Oceniana będzie posiadana przez nich wiedza oraz umiejętność jej wykorzystania. Pytania zostaną podane z wyprzedzeniem, a odpowiadając na nie uczestnicy będą mogli skorzystać z przygotowanych przez siebie materiałów.
Dopuszczalna liczba nieobecności: trzy. Po przekroczeniu limitu trzech nieobecności należy zaliczać przygotowując prace pisemne na tematy poruszane na wykładzie.
Egzamin poprawkowy będzie mieć formą identyczną jak ten w pierwszym terminie.
Do godzin przeznaczonych na zajęcia w sali (30h) należy doliczyć czas konieczny do przygotowania się do zajęć (czytanie lektur) – 2h tygodniowo oraz czas konieczny do przygotowania się do finalnego zaliczenia (egzaminu/ napisania eseju) – 10h",Inne
"Antropologia. Historia, teoria i praktyka badawcza",3.0,w sali,"Egzamin ustny
Wymagania egzaminacyjne – znajomość treść wykładów oraz wybranych zagadnień  z następujących lektur:· 
Barth F., Gingrich A., Parkin R., Silverman S., Antropologia. Jedna dyscyplina, cztery tradycje: brytyjska, niemiecka, francuska i amerykańska, Wyd. UJ, Kraków 2007.· 
Bernard A., Antropologia. Zarys teorii i historii, PIW, Warszawa 2006.· 
Kuper A., Między charyzmą a rutyną. Szkice z brytyjskiej antropologii społecznej 1982 –1982, Wyd. Łódzkie, Łódź 1986
Nowicka E., Świat człowieka - świat kultury, Wydanie nowe, Wydawnictwo PWN, Warszawa 2006.
Deliege R., Historia Antropologii, Oficyna Naukowa, Warszawa 2011.","Historia i archeologia, Socjologia i antropologia"
Dziedzictwo kulturowe i pamięć społeczna w ujęciu antropologicznym i socjologicznym,3.0,w sali,"Egzamin pisemny
Dopuszczalna liczba nieobecności podlegających usprawiedliwieniu: 2
Zasady zaliczania poprawkowego: Egzamin ustny
do godzin przeznaczonych na zajęcia w sali (30h) należy doliczyć czas konieczny do przygotowania się do zajęć (czytanie lektur) – 2h tygodniowo oraz czas konieczny do przygotowania się do finalnego zaliczenia (egzaminu) – 10h",Inne
Socjologia dewiacji,3.0,w sali,Pisemnie - test,Socjologia i antropologia
Socjologia ekonomiczna,3.0,w sali,"Zaliczenie zajęć odbywa się w formie egzaminu pisemnego (test z pytaniami zamkniętymi i otwartymi). Zaliczenie poprawkowe na takich samych warunkach, jak w pierwszym terminie. Dopuszczalne trzy nieobecności w ciągu semestru.",Socjologia i antropologia
Socjologia migracji,3.0,w sali,"Egzamin pisemny
Dopuszczalna liczba nieobecności podlegających usprawiedliwieniu: 4
Zasady zaliczania poprawkowego: takie same jak w pierwszym terminie
Korzystanie z narzędzi generatywnej sztucznej inteligencji, takich jak ChatGPT, jest dozwolone w przypadku wybranych zadań kursowych/zaliczeniowych. Domyślnie korzystanie z takich narzędzi jest zabronione, chyba że wyraźnie zaznaczono inaczej. Każde użycie musi zostać odpowiednio opisane i/lub zacytowane. Studenci/tki ponoszą odpowiedzialność za wszystkie treści wygenerowane z użyciem narzędzi AI.",Socjologia i antropologia
Wprowadzenie do socjologii polityki,3.0,zdalnie,Egzamin ustny obejmujący treści wykładu i literatury obowiązkowej.,Inne
"Wprowadzenie do teorii wyboru społecznego: decyzje, kooperacja, konkurencja, sprawiedliwość.",3.0,w sali,"egzamin pisemny, 
obecność 
egzamin poprawkowy pisemny
Do godzin przeznaczonych na zajęcia w sali (30h) należy doliczyć czas konieczny do przygotowania się do zajęć (czytanie lektur) – 2h tygodniowo oraz czas konieczny do przygotowania się do finalnego zaliczenia (egzaminu) – 15h",Inne
Socjologia kampanii wyborczej,3.0,w sali,egzamin pisemny Dopuszczalna liczba nieobecności podlegających usprawiedliwieniu: 2 Zasady zaliczania poprawkowego: egzamin ustny w sesji jesiennej,Socjologia i antropologia
Socjologia interakcji społecznych,3.0,w sali,"Egzamin pisemny: udzielenie krótkiej (ok. 100 słów) odpowiedzi na trzy pytania problemowe
Dopuszczalna liczba nieobecności podlegających usprawiedliwieniu: 2
Zasady zaliczania poprawkowego: Egzamin ustny: udzielenie krótkiej ustnej odpowiedzi na trzy pytania problemowe
do godzin przeznaczonych na zajęcia w sali (30h) należy doliczyć czas konieczny do przygotowania się do zajęć (czytanie lektur) – 2h tygodniowo oraz czas konieczny do przygotowania się do finalnego zaliczenia (egzaminu/ napisania eseju) – 10h",Socjologia i antropologia
Socjologia kulturowa,3.0,w sali,"Wysłuchanie wykładów, znajomość lektur, egzamin pisemny
Dopuszczalna liczba nieobecności podlegających usprawiedliwieniu - 2 
Zasady zaliczania poprawkowego, takie same jak w pierwszym terminie: egzamin pisemny
Do godzin przeznaczonych na zajęcia w sali (30h) należy doliczyć czas konieczny do przygotowania się do zajęć (czytanie lektur) – 2h tygodniowo oraz czas konieczny do przygotowania się do finalnego zaliczenia (egzaminu/ napisania eseju) – 10h",Socjologia i antropologia
Socjologia płci,3.0,w sali,,Socjologia i antropologia
Socjologia lokalności,3.0,w sali,Egzamin pisemny i obecność na wykładach.,Socjologia i antropologia
African popular and mass culture,3.0,w salizdalnie,"kontrola obecności 
bieżące przygotowanie do zajęć i branie udziału w dyskusji na podstawie zadanych lektur
projekty studenckie",Inne
"Gender, race, class and religion. Feminist theories in Africa",3.0,w sali,"(tylko po angielsku) Requirements for credit:
-attendance control (A student can be absent a maximum of twice during the semester. In the case of absence due to illness, the medical certificate excusing this absence should be submitted within seven days of the last day of the leave specified in the certificate.)
-continuous assessment
-semester paper.",Inne
Issues in African linguistics and communication,3.0,zdalnie,"- kontrola obecności 
- ocena aktywności na zajęciach (uczestnictwa w dyskusji nad tematyką lektur)
- końcowe zaliczenie (test pisemny)",Inne
Issues in contemporary African literatures,3.0,w sali,"Do zaliczenia będą dopuszczane osoby obecne na co najmniej połowie ogólnej liczby spotkań.
Studenci są zobowiązani do czytania zadawanych na bieżąco lektur, które będą omawiane podczas zajęć.
Podstawą do zaliczenia jest przygotowanie i przedstawienie podczas zajęć prezentacji na uzgodniony z prowadzącym temat.",Inne
Literatury Afryki 1,2.0,w sali,,Inne
Postcolonial perspectives in African Studies,3.0,w sali,"(tylko po angielsku) Requirements for credit:
-attendance control (A student can be absent a maximum of twice during the semester. In the case of absence due to illness, the medical certificate excusing this absence should be submitted within seven days of the last day of the leave specified in the certificate.)
-continuous assessment
-semester paper.",Inne
Symbole władzy w Afryce,1.0,w sali,Ocena zostanie wystawiona na podstawie zaangażowania i przygotowania w oparciu o wcześniej przesłane materiały.,Inne
Contemporary Africa: opportunities and challenges,3.0,w sali,,Inne
Myśl filozoficzna i teologiczna islamu,3.0,w sali,"egzamin ustny
Kontrola obecności - dopuszczalne dwie nieobecności, czyli 4 godz., w semestrze; w przypadku nieobecności spowodowanej chorobą zaświadczenie lekarskie usprawiedliwiające tę nieobecność powinno zostać przedłożone w terminie siedmiu dni roboczych od wskazanej w nim daty zakończenia zwolnienia.",Inne
Dzieje starożytnego Egiptu,2.0,w sali,,Inne
Religia starożytnego Egiptu,2.0,w sali,"Warunki zaliczenia:
- obecność,
- test wielokrotnego wyboru na koniec semestru",Filozofia i religia
"Historia Azji Środkowej i Mongolii (cz. 2, XX i XXI w.)",3.0,w sali,EGZAMIN PISMENY,Historia i archeologia
Co można wyczytać ze słownictwa tekstów biblijnych - wybrane zagadnienia z semantyki leksykalnej,3.0,w sali,"Metody i kryteria oceniania
Aktywność na zajęciach (30%)
Opracowanie i prezentacja na zajęciach wybranego zagadnienia bądź omówienie artykułu (30%)
Egzamin lub krótki esej (40%)",Inne
Dzieje narodu żydowskiego od starożytności do Haskali,2.0,w sali,"Końcowa ocena zaliczająca jest średnią obliczoną na podstawie ocen z egzaminu końcowego (testu), eseju lub referatu oraz obecności i aktywności na zajęciach.",Inne
Lektura wybranych ksiąg Nowego Testamentu przez pryzmat wczesnych tekstów judaizmu,3.0,w sali,"Aktywność na zajęciach (30%)
Opracowanie i prezentacja na zajęciach wybranego zagadnienia bądź omówienie artykułu (30%)
Egzamin lub krótki esej (40%)",Inne
Państwo Izrael-instytucje i polityka,2.0,w sali,"Zaliczenie na ocenę na podstawie:
* kontroli obecności,
* aktywnego uczestnictwa w zajęciach,
* pisemnego egzaminu końcowego (test + pytanie otwarte).
Frekwencja: 
Zgodnie z zarządzeniem KJD WO UW z dnia 31.07.2021:
- ""dopuszczalna liczba nieobecności nieusprawiedliwionych na zajęciach wynosi 15%""
- ""łączna liczba nieobecności usprawiedliwionych i nieusprawiedliwionych umożliwiająca podejścia do egzaminu wynosi 30%""
- ""Student winien usprawiedliwić nieobecność na zajęciach niezwłocznie i nie później niż w terminie 7 dni od ustania jej przyczyny. W szczególnie uzasadnionych przypadkach wykładowca może usprawiedliwić nieobecność po tym terminie.""",Prawo i polityka
Europejczycy w Japonii 1543-1853,3.0,w sali,"Ocena ciągła, której podstawę stanowią:
- przygotowanie studenta do zajęć
- aktywny udział w dyskusji
- rozmowa - zaliczenie ustne na koniec semestru (dla chętnych)
- obecność na zajęciach",Inne
Niematerialne dziedzictwo kultury w Japonii,3.0,w sali,"Zaliczenie zajęć na podstawie referatu wygłoszonego w czasie zajęć wg tematów zaproponowanych przez prowadzącą na pierwszych zajęciach (50%), aktywność na zajęciach i czytanie zadanych lektur (50%).
Obecnośc obowiązkowa, dopuszczone dwie nieusprawiedliwione nieobecności.",Inne
Stosunki polsko-japońskie w XX-XXI w.,3.0,w sali,"- egzamin ustny 
- obecność na zajęciach",Inne
Współczesna Japonia - wybrane zagadnienia,3.0,w sali,,Inne
Kultura biznesu w Azji i Afryce,2.0,w sali,"Obecność na zajęciach
Test jednokrotnego wyboru (pisemny).",Języki i kultury świata
Konwersatorium - języki i kultury Afryki,2.0,zdalnie,"Zaliczenie na ocenę. 
Wymagane 100% obecności, udział w dyskusji i praca pisemna.",Inne
Buddyjski modernizm,2.0,w sali,Obecność i aktywny udział w warsztatach.,Inne
Dyplomacja(Z),3.0,zdalnie,Egzamin na koniec semestru - test pisemny,Inne
Workshop: Major themes of African history,2.0,w sali,,Inne
Muzea w wielokulturowym świecie,3.0,w sali i w terenie,"Bieżące przygotowanie do zajęć i aktywność.
Ocena z egzaminu na podstawie wiedzy zdobytej podczas wykładów i z zalecanych lektur.",Inne
Muzułmanie na Zachodzie,2.0,w sali,,Inne
Negocjacje międzykulturowe,2.0,w sali,,Inne
Personal branding w środowisku wielokulturowym,1.0,w sali,,Inne
Prawa człowieka,2.0,mieszany: w sali i zdalniew sali,"- aktywne uczestnictwo w zajęciach (m.in. monitorowanie sytuacji praw człowieka w wybranym regionie Azji lub Afryki)
- prezentacja ustna
- esej pisemny / test końcowy
- kontrola obecności (dopuszczalne dwie nieobecności, czyli 4 godz., w semestrze; w przypadku nieobecności spowodowanej chorobą zaświadczenie lekarskie usprawiedliwiające tę nieobecność powinno zostać przedłożone w terminie siedmiu dni od wskazanej w nim daty zakończenia zwolnienia)",Inne
Workshop: Post-Independent Africa: The challenges and possible sulutions,2.0,w sali,,Inne
Rola więzi społecznych w procesie komunikacji w społeczeństwie koreańskim,1.0,w sali,,Inne
Stosunki międzynarodowe w Azji i Afryce z uwzględnieniem historii obszarów  - wykład i ćwiczenia,3.0,w sali,"Wymagana obecność na zajęciach ćwiczeniowych, dopuszczona jedna nieobecność w semestrze. 
Ocena na podstawie egzaminu oraz aktywności na zajęciach ćwiczeniowych.",Inne
Teoria komunikacji,3.0,w sali,"Ocena z egzaminu pisemnego (lub, jeśli niebędzie możliwości przeprowadzenia stacjonarnego egzaminu pisemnego, z egzaminu ustnego on-line) na podstawie wiedzy zdobytej w trakcie wykładów oraz z zalecanych lektur. Jeśli nie będzie możliwe stacjonarne przeprowadzenie egzaminu pisemnego, egzamin on-line będzie miał formę ustną.",Inne
Kurs na Równość - przeciwdziałanie dyskryminacji na UW,2.0,zdalnie,"Zaliczenie całości interaktywnego kursu równa się ocenie bardzo dobrej.
Niższe oceny stanowią procentowy wymiar ukończenia kursu. Najniższa pozytywna ocena to 60% kursu.",Równość i prawa człowieka
Historia Azji Środkowej i Mongolii (cz.1) (Z),2.0,mieszany: w sali i zdalniew sali,"OBECNOŚĆ NA ZAJĘCIACH, EGZAMIN PISEMNY / USTNY
EGZAMIN PISEMNY / USTNY",Historia i archeologia
Historia Tybetu,3.0,mieszany: w sali i zdalniew sali,"OBECNOŚC NA ZAĘCIACH, EGZAMIN PISEMNY",Historia i archeologia
Religie Tybetu,3.0,mieszany: w sali i zdalniew sali,"OBECNOŚC NA ZAJĘCIACH, EGZAMIN PISEMNY I USTNY",Inne
"Textology, orality and performing arts in Asia and Africa - lecture(15h) and seminar(30h)",4.0,w sali,Exam,Inne
Sztuka i estetyka Tybetu,3.0,w sali,"OBECNOŚC NA ZAJĘCIACH, EGZAMIN PISEMNY",Inne
Nie tylko Pamuk: literatura turecka po polsku,3.0,mieszany: w sali i zdalniew salizdalnie,"Ocena ciągła (50%) - przygotowanie do zajęć i aktywność podczas nich (student przygotowuje się do spotkania poprzez lekturę dostarczonego przez prowadzącego tekstu - opowiadania lub fragmentu powieści, aby móc efektywnie uczestniczyć w zajęciach, zadawać pytania, brać udział w dyskusji). 
Zaliczenie ustne (50%) - maks. 15 minutowe wystąpienie na temat wybranej powieści tureckiej przełożonej na j. polski przeczytanej w całości, odpowiedź na ew. pytania dotyczące utworu, autora, kontekstu historycznego i kulturowego.
Dozwolone są dwie nieusprawiedliwione nieobecności w semestrze. Nieobecność, usprawiedliwiona bądź nie, na więcej niż 50% zajęć skutkuje niedopuszczeniem do egzaminu.",Języki i kultury świata
Buddhism,4.0,w sali,egzamin pisemny (test),Inne
Islam,4.0,w sali,egzamin pisemny (test),Inne
Indian Buddhist Monasticism: Special Topic Lecture (Buddhism),3.0,w sali,Zaliczenie na ocenę w formie pisemnej (test).,Inne
Interreligious Relations and Dialogue (Religion and Society in Asia and Africa),3.0,w sali,Egzamin pisemny (test),Inne
Other Religions and Beliefs of Asia and Africa (Z),3.0,w sali,"Aktywność na zajęciach, egzamin pisemny (test).",Inne
Religious Arts and Symbols (Religion and Society in Asia and Africa),3.0,w sali i w terenie,Written exam (test). A minimum score of 60% is required to pass.,Inne
Religious Conflicts and Controversial Issues (Religion and Society in Asia and Africa),3.0,w sali,Egzamin pisemny (test),Inne
Różnorodność kulturowa i religijna Azerbejdżanu,3.0,w sali,"Egzamin ustny
Stopień przyswojenia materiału omawianego podczas zajęć, aktywność w dyskusji.
Ze względu na monograficzny i autorski charakter wykładu, obecność na zajęciach stanowi podstawę zaliczenia. Treści prezentowane podczas zajęć nie są w pełni
dostępne w ogólnodostępnej literaturze przedmiotu, a stanowią oryginalne opracowanie merytoryczne opracowane przez prowadzącego.
 100% obecności – 50 punktów (ocena dostateczna – 3.0)
 2. Egzamin ustny (50% oceny):
Podczas egzaminu student odpowiada na kilka pytań z materiału omawianego na wykładach. Ocena zależy od poziomu szczegółowości odpowiedzi oraz znajomości
kontekstu i kluczowych zagadnień.
 Bardzo dobra (5.0): pełna i wyczerpująca odpowiedź, znajomość szczegółów
i kontekstu.
 Dobry plus (4.5): odpowiedź poprawna z drobnymi brakami.
 Dobry (4.0): poprawna odpowiedź na większość pytań.
 Dostateczny plus (3.5): odpowiedzi ogólne, z podstawową znajomością tematu.
 Dostateczny (3.0): minimalne odpowiedzi na pytania, ale wykazanie się podstawową wiedzą",Inne
Religious Texts in Asia and Africa (Z),3.0,w sali,egzamin pisemny,Inne
Savoir vivre w kulturach Azji i Afryki,2.0,w sali,udział i aktywność na zajęciach oraz końcowy test sprawdzający nabytą wiedzę,Inne
Historia Turcji II,3.0,mieszany: w sali i zdalniew sali,"Student powinien zapoznać się ze źródłami historycznymi i literaturą szczegółową (co najmniej 6 pozycji) wybranymi przez siebie z listy dostarczonej przez wykładowcę. Zakres końcowego egzaminu obejmować będzie oprócz faktografii z wykładu i podręczników również treść tych lektur.
Egzamin ustny",Historia i archeologia
Kultura Azerbejdżanu,3.0,w sali,Egzamin ustny: obejmujący materiał omówiony podczas wykładów,Języki i kultury świata
Współczesna Afryka: zagadnienia społeczno-polityczne,3.0,w sali,"- Kontrola obecności. Dopuszczalne dwie nieobecności (czyli 4 godz.) w semestrze. W przypadku nieobecności spowodowanej chorobą
zaświadczenie lekarskie usprawiedliwiające tę nieobecność powinno zostać przedłożone w terminie siedmiu dni od wskazanej w nim daty
zakończenia zwolnienia.
- Aktywne uczestnictwo w zajęciach: udział w dyskusjach na temat aktualnych wydarzeń w regionie
- Prezentacja ustna
- Test końcowy",Inne
Antropologia etniczności i nacjonalizmu1,3.0,w sali,"-             egzamin pisemny.
-             kontrola obecności.",Socjologia i antropologia
"Wprowadzenie do religioznawstwa - definicje, teorie, problemy",3.0,w sali,,Inne
Państwa i narody Kaukazu. Historia i kultura,3.0,,praca pisemna (esej) na zakończenie kursu,"Historia i archeologia, Języki i kultury świata"
Ateizm i radziecka propaganda antyreligijna,3.0,,Egzamin pisemny lub ustny,Inne
Białoruś 2020,3.0,zdalnie,"Wymogi:
1. Obecność
- max. 3 nieobecności;
- powyżej 3 nieobecności - zaliczenie poszczególnych tematów;
- od 7 nieobecności - skreślenie.
2. Test zaliczeniowy:
- test w pierwszy wtorek po zakończeniu wykładu, wtorek 18.30-20.00;
- pytania zamknięte;
3. Poprawka w sesji poprawkowej",Inne
Białoruskie elity polityczne: od homo sovieticus do elit narodowych,3.0,,"Obecność i aktywność na zajęciach;
Zaliczenie - egzamin końcowy lub esej.",Inne
Białorusini a idea jedności wschodniosłowiańskiej w XIX-XXI wieku,3.0,zdalnie,"- ocenianie ciągłe w trakcie zajęć, w tym weryfikacja znajomości pozycji z listy lektur
- praca pisemna /esej/ i prezentacja na zakończenie kursu
- test",Inne
Białoruski nacjonalizm na tle procesów narodotwórczych w Europie w XIX i XX wieku,3.0,zdalnie,"- praca pisemna /esej/ czyli prezentacja wybranego tematu na zakończenie kursu
 - praca pisemna /test/ na zakończenie kursu
 - frekwencja na zajęciach.",Inne
"Czechosłowacja - historia, kultura, społeczeństwo. 1918-1992",3.0,,"egzamin końcowy, pisemny na platformie Kampus","Historia i archeologia, Języki i kultury świata"
"Dawna Rzeczpospolita w kulturach pamięci Białorusi, Litwy i Ukrainy",3.0,,"W ocenie będą stosowane następujące kryteria:
-obecność na zajęciach (dopuszczalna liczba  nieusprawiedliwionych nieobecności – 3)
- egzamin pisemny na zakończenie kursu",Inne
Domestic Sources of US Foreign Policy in the Post-Soviet Era,4.0,lektura monograficznazdalnie,"(tylko po angielsku) No more than two absences from class are allowed; students are expected to attend all classes, on time. Class discussion accounts for 25% of the grade; if you don't participate actively in class your grade will suffer. A final, analytical essay on a mutually agreeable topic is mandatory, to be submitted in English via email. Detailed requirements for the essay and a non-extendable due date will be announced in class.",Inne
"The economic model of Belarus under A. Lukashenka’s regime: emergence, functioning, social and political consequences",4.0,,Aktywność studenta na zajęciach + egzamin ustny,Inne
Elity polityczne w procesie transformacji państw postradzieckich (Политические элиты в процессе трансформации постсоветских государств),3.0,,"Эссе (6-8 тыс. знаков) на одну из тем в рамках занятий или устный экзамен.
Дополнительным критерием финальной оценки будет посещаемость на занятиях.",Inne
Europa - Rosja. Stosunki geopolityczne z perspektywy historycznej,3.0,,"Egzamin ustny lub pisemny
Obecność na zajęciach",Inne
Gruzja w obiektywie: współczesne wyzwania społeczne i polityczne w kinie dokumentalnym,2.0,zdalnie,"Obecność na zajęciach, praca zaliczeniowa (esej).",Inne
Genealogia stosowana. Rodzina jako wspólnota pamięci historycznej,3.0,,"– obecność na zajęciach
– praca pisemna /esej/ lub prezentacja na zakończenie kursu",Inne
Horrory Europy Wschodniej: kultura grozy krajów poradzieckiech,3.0,zdalnie,"Forma zaliczenia
Kryteria oceniania - obecność na zajęciach (dopuszczane są 2 nieusprawiedliwione nieobecności)
- aktywność na zajęciach
- zapoznanie się z materiałami źródłowymi (przede wszystkim wybrane filmy gatunkowe, teksty literackie i analityczne)
- egzamin",Języki i kultury świata
"History, Identity, and Return of Geopolitics: Russo-Ukrainian War in the Postcolonial Context",4.0,zdalnie,(tylko po angielsku) Written esseys (50%) + final exam - written or oral (50%),Inne
